{
  "phase": "substantiate",
  "session_id": "2026-06-09T0000-gov03156",
  "ts": "2026-06-10T06:20:40Z",
  "verdict": "PASS",
  "merkle_seal": "67207cc0fcc330f8d6560c6f562dbde4330c3f1d6f48c39eea752de1da73fe08",
  "content_hash": "6a18c621ad264d9d8f7bbb7ecfe7450e955909215714ff21b33ac8215c31770f",
  "ledger_entry": 364,
  "reality_check": {
    "reality_equals_promise": true,
    "plan_path": "docs/plan-qor-phase156-gov03-committed-seal-reverify.md",
    "files_touched": [
      "qor/reliability/seal_entry_check.py",
      "qor/scripts/ledger_hash.py",
      ".github/workflows/ci.yml",
      "tests/test_seal_entry_check_auto.py",
      "docs/plan-qor-phase89-ci-commands-reconciliation.md"
    ]
  },
  "ai_provenance": {
    "system": "Qor-logic",
    "version": "0.109.4",
    "host": "unknown",
    "model_family": "unknown",
    "human_oversight": "pass",
    "ts": "2026-06-10T06:20:40Z"
  }
}