{
  "phase": "substantiate",
  "session_id": "2026-05-24T0500-phase102-p1",
  "ts": "2026-05-24T19:08:05Z",
  "verdict": "PASS",
  "reality_check": {
    "missing": [],
    "unplanned": [],
    "matches": 17
  },
  "merkle_seal": "e4a31810be163e5b48a944a720bacd27316f50f3bdb4ed7ed4c3e3cbcd691716",
  "content_hash": "7fe7cc1c412eaeb0e785baea8e57adc99518158eee0afed4e79b7ea3cdc58b39",
  "ledger_entry": 278,
  "ai_provenance": {
    "system": "Qor-logic",
    "version": "0.70.0",
    "host": "unknown",
    "model_family": "unknown",
    "human_oversight": "pass",
    "ts": "2026-05-24T19:08:05Z"
  }
}