{
  "phase": "substantiate",
  "session_id": "2026-07-15T2205-a205c0",
  "ts": "2026-07-15T22:09:05Z",
  "verdict": "PASS",
  "merkle_seal": "8b4bd6c7a5dba4d0e681b26d964bf3f0cfd690d443699a9b964c26a300fee417",
  "content_hash": "626ee3d8eecc971afa73c4a751fcb2edb5b625e2d99ff36bfb36b6c3de42b8df",
  "ledger_entry": 499,
  "reality_check": {
    "missing": [],
    "unplanned": [],
    "matches": 5
  },
  "ai_provenance": {
    "system": "Qor-logic",
    "version": "0.133.0",
    "host": "chatgpt-github-connector",
    "model_family": "gpt-5.6-thinking",
    "human_oversight": "pass",
    "ts": "2026-07-15T22:09:05Z"
  }
}
