{
  "phase": "substantiate",
  "session_id": "2026-05-14T1926-cc4683",
  "ts": "2026-05-14T19:49:53Z",
  "verdict": "PASS",
  "merkle_seal": "1b56f56a9968f174b7560e856054f15636f5867bcea1cdf02e1da5f94af9752e",
  "content_hash": "cf8c6c159c0fddf42f1d71edaf73b906aa72d005b0a2bd7897a3123913afe847",
  "ledger_entry": 204,
  "reality_check": {
    "missing": [],
    "unplanned": [],
    "matches": 5
  },
  "ai_provenance": {
    "system": "Qor-logic",
    "version": "0.47.4",
    "host": "unknown",
    "model_family": "opus",
    "human_oversight": "pass",
    "ts": "2026-05-14T19:49:53Z"
  }
}