{
  "phase": "substantiate",
  "session_id": "2026-05-14T1902-7b3e5d",
  "ts": "2026-05-14T19:23:26Z",
  "verdict": "PASS",
  "merkle_seal": "57247161064057779953c3cb90ffa44b62d93bd620351ef2c443a2c5aecb4ccd",
  "content_hash": "a4e93314632c5681732e4373d092fae6e929844410988e4d42c420a5ccd5309b",
  "ledger_entry": 203,
  "reality_check": {
    "missing": [],
    "unplanned": [],
    "matches": 9
  },
  "ai_provenance": {
    "system": "Qor-logic",
    "version": "0.47.3",
    "host": "unknown",
    "model_family": "opus",
    "human_oversight": "pass",
    "ts": "2026-05-14T19:23:26Z"
  }
}